pmid	geneId	diseaseId	g_name	d_name	is_befree	is_dtminer	is_ft1	hit_ft1	hit_abs	1st_label	2nd_label	is_ner_error	is_complex	have_s	target_sentences	in abs	in_intro	in_method	in_result	in_diss	in_conclusion	Have -	S no strong	comment	is_target_knowledge
24809021	1116	D005910	YKL-40 | cartilage glycoprotein 39 | chitinase 3-like 1 | CHI3L1	glioma | gliomas | mesenchymal glioma	1	1	1.0	10	8.0	1.0	1.0				Further studies are needed to evaluate if longitudinal serum YKL-40 measurements could be a reliable marker for diagnosis of glioma transformation from the less aggressive proneural subtype to the more aggressive mesenchymal subtype.	1.0	3.0								1.0
24809021	1116	D007674	YKL-40 | cartilage glycoprotein 39 | chitinase 3-like 1 | CHI3L1	embryonic kidney	0	1	1.0	4			0.0	Dki													
24809021	1116	D009336	YKL-40 | cartilage glycoprotein 39 | chitinase 3-like 1 | CHI3L1	necrosis	0	0	1.0	4			0.0														
24809021	1116	D009837	YKL-40 | cartilage glycoprotein 39 | chitinase 3-like 1 | CHI3L1	oligodendroglioma	0	1	1.0	4			1.0		C		 In anaplastic oligodendroglioma, loss of heterozygosity in chromosome 10q correlated with increased YKL-40 expression but no correlation was found with 1p19q codeletion.		1.0								
24809021	1116	D010020	YKL-40 | cartilage glycoprotein 39 | chitinase 3-like 1 | CHI3L1	avascular tumors	0	1	1.0	4			1.0				the inhibition of VEGFA by RNA interference in human glioma cells produced avascular tumors that revealed an upregulation of CHI3L1/YKL-40. 		1.0								
24809021	1116	D053632	YKL-40 | cartilage glycoprotein 39 | chitinase 3-like 1 | CHI3L1	SCID	0	0	1.0	4			0.0	Dki													
24810596	4193	D058186	MDM2	ARF	1	1	1.0	9			0.0	Dki													
24810596	7157	D058186	p53	ARF	1	1	1.0	10	10.0	1.0	0.0	Dki			These observations suggest an unusually complex interplay among NIAM, ARF, p53, and the cell cycle-regulatory machinery.		3.0								1.0
24810596	84897	D058186	nuclear interactor of ARF and MDM2 | NIAM	ARF	1	1	1.0	10	10.0	1.0	0.0	Dki			These observations suggest an unusually complex interplay among NIAM, ARF, p53, and the cell cycle-regulatory machinery.		2.0								1.0
24898186	79585	D010146	POD1 and 4	pain	1	0		0	3.0	1.0	1.0	Di			pain at ambulation for these patients was 6 [4, 7] on POD1 and 4 [3, 5] on POD2 (Fig. 1).				1.0						1.0
25043992	3553	D001424	IL-1beta	bacterial infection	0	0	1.0	7			0.0														
25043992	3553	D005334	IL-1beta	fever	0	0	1.0	3			0.0														
25043992	3553	D007029	IL-1beta	hypothalamus	0	0	1.0	3			0.0														
25043992	3553	D008569	IL-1beta	memory impairments | memory declines | memory impairment | neuroinflammation and memory impairment following peripheral infection | memory deficits	1	1	1.0	7	6.0	1.0	1.0				These data are consistent with our recent finding that voluntary exercise in aged rats robustly prevented E. coli-induced IL-1beta elevations in the hippocampus as well as the associated hippocampal-dependent memory deficits.					1.0					1.0
25043992	3569	D008569	IL-6 | IL-6 and TNFalpha	memory impairments | memory declines | memory impairment | neuroinflammation and memory impairment following peripheral infection | memory deficits	0	0		0	2.0	0.0	0.0													no e	
25043992	7124	D008569	TNFalpha	memory impairments | memory declines | memory impairment | neuroinflammation and memory impairment following peripheral infection | memory deficits	0	0		0	2.0	0.0	0.0													no e	
25143772	100379198	D012640	BECTS	seizures	1	1		0	6.0	0.0	0.0	Gm													
25273894	5243	C564766	P-glycoprotein | P-gp | mdr-1	bile transport defects	0	0	1.0	3			1.0		Cm		ABC genes are essential for many processes in the cell and mutations cause or contribute to several genetic disorders such as cystic fibrosis, neurological disease, retinal degeneration, Stargardt disease, cholesterol and bile transport defects, anemia, and abnormal drug responses).		1.0								
25273894	5243	D003550	P-glycoprotein | P-gp | mdr-1	cystic fibrosis	0	0	1.0	5			1.0		Cm		ABC genes are essential for many processes in the cell and mutations cause or contribute to several genetic disorders such as cystic fibrosis, neurological disease, retinal degeneration, Stargardt disease, cholesterol and bile transport defects, anemia, and abnormal drug responses).		1.0								
25273894	5243	D011535	P-glycoprotein | P-gp | mdr-1	PBS-T	0	0	1.0	4			0.0	Gki												PBS and 1% Tween-20	
25273894	5243	D015799	P-glycoprotein | P-gp | mdr-1	OAT	1	1	1.0	5			0.0	Dkmi													
25273894	5243	D064420	P-glycoprotein | P-gp | mdr-1	drug toxicity | cytotoxicity | Cytotoxicity | toxicity	1	1	1.0	8	2.0	1.0	1.0	Di			Co-administration with P-gp inhibitors or inducers changes the absorption profile as well as the risk for drug toxicity	1.0					1.0			ill D	1.0
25405347	5177	D006973	PIH	hypertension	0	0		0	3.0	0.0	0.0	Gmki												pregnancy induced hypertension	
25405347	7126	D007249	B12	inflammation | inflammatory dysfunction	1	1	1.0	3			0.0	Gki													
25478511	10242	D054549	beta-2	Takotsubo cardiomyopathy | Takotsubo cardiomypathy	1	1	1.0	9	2.0	0.0	0.0	Gki													
25478511	6285	D054549	Nef	Takotsubo cardiomyopathy | Takotsubo cardiomypathy	1	1	1.0	10	2.0	0.0	0.0	Gki												 Nef et al. 	
25491605	5578	D007247	PKC | PKCalpha	infertility	1	1	1.0	5	2.0	1.0	1.0				The proof of PKC isoform specifity for particular ovarian functions will allow the use of isoform specific inhibitors or activators to compensate ovarian dysfunction which is one of the major causes of female infertility.						1.0				1.0
25491605	5578	D010051	PKC | PKCalpha	ovaries | PND1 ovaries	1	1	1.0	10	10.0	1.0	1.0				PKCepsilon expression level was significantly higher in PND60 and PND21 ovaries when compared to pre-pubertal PND7 and PND1 ovaries	1.0			2.0	1.0					1.0
25491605	5580	D010051	PKCdelta | sc-208) PKCdelta (sc-937	ovaries | PND1 ovaries	1	1	1.0	10	1.0	1.0	1.0				PKCdelta was detected in the cytoplasm of granulosa cells, theca cells and oocytes of all groups and luteal cells of PND60 ovaries	1.0			2.0						1.0
25491605	5581	D010051	PKCepsilon	ovaries | PND1 ovaries	1	1	1.0	6			1.0				 PKCepsilon protein expression was significantly higher in adult PND60 and pubertal PND21 ovaries when compared to pre-pubertal PND7 and PND1 ovaries. 	1.0			1.0	1.0					
25551576	11006	D007249	Immunoglobulin-like transcript (ILT) 3 and 4 | ILT3	inflammation	1	1	1.0	3			1.0				The role of immunoregulatory receptors in CNS inflammation is further highlighted by their enrichment in cerebrospinal fluid and an upregulation of ILT3, ILT4, and B7-H3 in acute MS lesions.		1.0			1.0					
25551576	11006	D008545	Immunoglobulin-like transcript (ILT) 3 and 4 | ILT3	melanoma | malignant melanoma	0	0	1.0	6			0.0														
25551576	11006	D009103	Immunoglobulin-like transcript (ILT) 3 and 4 | ILT3	multiple sclerosis | Multiple sclerosis | Multiple Sclerosis	1	1	1.0	10	5.0	1.0	1.0				Our data are consistent with involvement of ILT3 and ILT4 in the modulation of immune responsiveness in multiple sclerosis by both interferon and vitamin D.	1.0				1.0					1.0
25657186	10590	D020521	secretagogin	stroke | vessel stroke | acute stroke | cardioembolic stroke	0	1	1.0	3	2.0	1.0	1.0				soluble receptor for advanced glycation end products (sRAGE), chimerin, secretagogin, and MMP-9) identified stroke with 98% sensitivity and 17% specificity. 		1.0							intro + concl, no abs	1.0
25657186	1956	D020521	epidermal growth factor receptor | EGFR	stroke | vessel stroke | acute stroke | cardioembolic stroke	0	1	1.0	4	2.0	1.0	1.0				In a study of 130 patients with acute stroke (57 ischemic, 32 hemorrhagic, 41 TIA) and 37 stroke mimics, a panel of 5 markers (eotaxin, epidermal growth factor receptor (EGFR), S100A12, metalloproteinase inhibitor-4, and prolactin) distinguished stroke from controls with 90% sensitivity and 84% specificity. 		1.0							intro + concl, no abs	1.0
25657186	2026	D020521	neuron specific enolase | NSE	stroke | vessel stroke | acute stroke | cardioembolic stroke	0	1	1.0	6	3.0	1.0	1.0				Other biomarkers have been well studied in stroke including natriuretic peptides, glial fibrillary acidic protein (GFAP), S100b, neuron specific enolase (NSE), myelin basic protein (MBP), interleukin-6, matrix metalloproteinase (MMP)-9, D-dimer, and fibrinogen.		1.0								1.0
25657186	2244	D020521	fibrinogen	stroke | vessel stroke | acute stroke | cardioembolic stroke	0	1	1.0	3	2.0	1.0	1.0				Other biomarkers have been well studied in stroke including natriuretic peptides, glial fibrillary acidic protein (GFAP), S100b, neuron specific enolase (NSE), myelin basic protein (MBP), interleukin-6, matrix metalloproteinase (MMP)-9, D-dimer, and fibrinogen.		1.0								1.0
25657186	2670	D020521	glial fibrillary acidic protein | GFAP	stroke | vessel stroke | acute stroke | cardioembolic stroke	0	1	1.0	5	3.0	1.0	1.0				Other biomarkers have been well studied in stroke including natriuretic peptides, glial fibrillary acidic protein (GFAP), S100b, neuron specific enolase (NSE), myelin basic protein (MBP), interleukin-6, matrix metalloproteinase (MMP)-9, D-dimer, and fibrinogen.		1.0								1.0
25657186	3569	D020521	interleukin-6 | IL-6	stroke | vessel stroke | acute stroke | cardioembolic stroke	1	1	1.0	6	2.0	1.0	1.0				Other biomarkers have been well studied in stroke including natriuretic peptides, glial fibrillary acidic protein (GFAP), S100b, neuron specific enolase (NSE), myelin basic protein (MBP), interleukin-6, matrix metalloproteinase (MMP)-9, D-dimer, and fibrinogen.		1.0								1.0
25657186	4155	D020521	myelin basic protein | MBP	stroke | vessel stroke | acute stroke | cardioembolic stroke	0	1	1.0	4	2.0	1.0	1.0				Other biomarkers have been well studied in stroke including natriuretic peptides, glial fibrillary acidic protein (GFAP), S100b, neuron specific enolase (NSE), myelin basic protein (MBP), interleukin-6, matrix metalloproteinase (MMP)-9, D-dimer, and fibrinogen.		1.0								1.0
25657186	4318	D020521	matrix metalloproteinase (MMP)-9 | MMP9 | MMP-9	stroke | vessel stroke | acute stroke | cardioembolic stroke	1	1	1.0	10	3.0	1.0	1.0				Other biomarkers have been well studied in stroke including natriuretic peptides, glial fibrillary acidic protein (GFAP), S100b, neuron specific enolase (NSE), myelin basic protein (MBP), interleukin-6, matrix metalloproteinase (MMP)-9, D-dimer, and fibrinogen.		1.0								1.0
25657186	4879	D020521	BNP	stroke | vessel stroke | acute stroke | cardioembolic stroke	1	1	1.0	9	2.0	1.0	1.0				BNP and D-dimer have also been evaluated as a panel to determine cause of ischemic stroke.		2.0								1.0
25657186	4908	D020521	neurotrophin-3	stroke | vessel stroke | acute stroke | cardioembolic stroke	1	0	1.0	4	2.0	0.5	0.5				Of interest, markers such as S100B, brain natriuretic peptide, and neurotrophin-3 were not significantly different between stroke and stroke mimics and did not add to the predictive models for stroke diagnosis.		1.0					1.0	1.0		1.0
25657186	5617	D020521	prolactin	stroke | vessel stroke | acute stroke | cardioembolic stroke	1	1	1.0	4	2.0	1.0	1.0				In a study of 130 patients with acute stroke (57 ischemic, 32 hemorrhagic, 41 TIA) and 37 stroke mimics, a panel of 5 markers (eotaxin, epidermal growth factor receptor (EGFR), S100A12, metalloproteinase inhibitor-4, and prolactin) distinguished stroke from controls with 90% sensitivity and 84% specificity.		1.0								1.0
25657186	6283	D020521	S100A12	stroke | vessel stroke | acute stroke | cardioembolic stroke	0	1	1.0	4	2.0	1.0	1.0				In a study of 130 patients with acute stroke (57 ischemic, 32 hemorrhagic, 41 TIA) and 37 stroke mimics, a panel of 5 markers (eotaxin, epidermal growth factor receptor (EGFR), S100A12, metalloproteinase inhibitor-4, and prolactin) distinguished stroke from controls with 90% sensitivity and 84% specificity.		1.0								1.0
25657186	6285	D020521	S100b | S100B	stroke | vessel stroke | acute stroke | cardioembolic stroke	1	1	1.0	10	2.0	1.0	1.0				A subsequent study evaluated a panel of 4 markers (BNP, D-dimer, MMP9, S100B) in 585 patients with acute stroke		1.0								1.0
25657186	6347	D020521	MCP-1 | monocyte chemotactic protein-1	stroke | vessel stroke | acute stroke | cardioembolic stroke	1	1	1.0	3	2.0	1.0	1.0		m		Biomarker panels have also been evaluated for the diagnosis of ischemic stroke. These include a panel of 5 proteins (MMP9, BNGF, vWF, MCP-1, S100B), a panel of 4 proteins (MMP9, brain natriuretic factor, D-dimer, and S100B), and a panel of 5 proteins (eotaxin, epidermal growth factor receptor, S100A12, metalloproteinase inhibitor-4 and prolactin).		1.0							m s	1.0
25657186	6356	D020521	eotaxin	stroke | vessel stroke | acute stroke | cardioembolic stroke	0	1	1.0	4	2.0	1.0	1.0		m		Biomarker panels have also been evaluated for the diagnosis of ischemic stroke. These include a panel of 5 proteins (MMP9, BNGF, vWF, MCP-1, S100B), a panel of 4 proteins (MMP9, brain natriuretic factor, D-dimer, and S100B), and a panel of 5 proteins (eotaxin, epidermal growth factor receptor, S100A12, metalloproteinase inhibitor-4 and prolactin).		1.0							m s	1.0
25657186	7079	D020521	metalloproteinase inhibitor-4	stroke | vessel stroke | acute stroke | cardioembolic stroke	0	1	1.0	4	2.0	1.0	1.0		m		Biomarker panels have also been evaluated for the diagnosis of ischemic stroke. These include a panel of 5 proteins (MMP9, BNGF, vWF, MCP-1, S100B), a panel of 4 proteins (MMP9, brain natriuretic factor, D-dimer, and S100B), and a panel of 5 proteins (eotaxin, epidermal growth factor receptor, S100A12, metalloproteinase inhibitor-4 and prolactin).		1.0							m s	1.0
25657186	7450	D020521	vWF | von Willebrand factor	stroke | vessel stroke | acute stroke | cardioembolic stroke	1	1	1.0	3	2.0	1.0	1.0		m		Biomarker panels have also been evaluated for the diagnosis of ischemic stroke. These include a panel of 5 proteins (MMP9, BNGF, vWF, MCP-1, S100B), a panel of 4 proteins (MMP9, brain natriuretic factor, D-dimer, and S100B), and a panel of 5 proteins (eotaxin, epidermal growth factor receptor, S100A12, metalloproteinase inhibitor-4 and prolactin).		1.0							m s	1.0
25657186	836	D020521	caspase-3	stroke | vessel stroke | acute stroke | cardioembolic stroke	1	1	1.0	3	2.0	1.0	1.0				In a study of 915 patients with acute stroke (776 ischemic, 139 hemorrhagic) and 90 stroke mimics, a panel of 6 markers (caspase-3, D-dimer, soluble receptor for advanced glycation end products (sRAGE), chimerin, secretagogin, and MMP-9) identified stroke with 98% sensitivity and 17% specificity.		1.0								1.0
25825024	668542	D001168	IgG	arthritis	1	1	1.0	3			1.0				galactosylation and fucosylation of total IgG and disease-specific autoantibodies (ACPA) in 30 patients with rheumatoid arthritis and related these results to bone microstructures of the distal radius measured by micro-computed tomography (muCT). 				1.0						
25825024	668542	D001172	IgG	rheumatoid arthritis | joints of rheumatoid arthritis	1	1	1.0	7			1.0				In accordance with these findings, analysis of the sialic acid content per galactose residue on IgG in rheumatoid arthritis patients showed a significant association of higher sialylation rates with increased bone volume and trabecular numbers (Supplementary Fig. 7)	1.0			1.0						
25825024	668542	D016301	IgG	bone loss | osteoclastogenesis and bone loss | systemic bone loss	1	1	1.0	10	4.0	1.0	1.0				We have also found a significant correlation between IgG Fc galactosylation and bone architecture in rheumatoid arthritis patients.	1.0	1.0			1.0					1.0
25829796	128	D000544	s-nitrosoglutathione reductase	AD	0	0		0	2.0	0.0	0.0	Dki												Alcohol dehydrogenase	
25852568	3553	D005221	IL-1-beta | IL-1	fatigue | brain fatigue | tiredness	1	1		0		1.0	1.0				highlighting that IL-1 in the brain is the likely cause of early fatigue in these groups.		1.0							intro + concl	1.0
25852568	3569	D005221	IL-6	fatigue | brain fatigue | tiredness	0	0		0		0.0	0.0														
25905096	155871	D015658	Tat	HIV-Infected | HIV infection | HIV-infected	1	1		0	2.0	1.0	1.0				Tat is another viral protein secreted by HIV-infected cells		1.0							into + concl	1.0
25905096	156110	D015658	Nef	HIV-Infected | HIV infection | HIV-infected	0	0		0	2.0	1.0	1.0				Other HIV viral proteins, such as Nef and Tat, lead to chronic inflammation and endothelial dysfunction and may play a role in HIV-PAH pathogenesis.		1.0								1.0
25905096	920	D015658	CD4	HIV-Infected | HIV infection | HIV-infected	0	0		0	2.0	1.0	1.0		Cm		Most authors could not show an association between HIV-PAH and low CD4 T cell count, even if the proportion of patients with CD4 count <200/mm3 was higher among HIV-PAH patients in one study. On the other hand, other groups described an increased survival rate with increasing CD4 counts.		1.0					1.0			1.0
25926995	100128998	D016470	tissue plasminogen activator	bacteremia	1	1		0	1.0	0.0	0.0														
25926995	5327	D016470	tPA	bacteremia	0	0		0	1.0	0.0	0.0														
25935745	54535	D001523	HCR	psychiatric | illegal behaviors | aggression | mental disorder | psychiatric stability | changing psychiatric symptoms	0	1		0	1.0	0.0	0.0														
25940564	7276	C567782	Transthyretin | TTR	FAP	1	1	1.0	6			1.0				There are more than 111 amyloidogenic point mutations in the TTR gene that are the cause of familial amyloid cardiomyopathy (FAC), characterized by primarily cardiac TTR deposition, and familial amyloidotic polyneuropathy (FAP)		1.0								
25940564	7276	D000686	Transthyretin | TTR	amyloidosis	0	0	1.0	4			0.0														
25940564	7276	D001172	Transthyretin | TTR	RA joints	1	1	1.0	3			1.0				TTR containing amyloid has also been found in a small number of RA joints.		1.0								
25940564	7276	D002349	Transthyretin | TTR	carpal tunnel syndrome	1	1	1.0	4			1.0				In a study of patients with carpal tunnel syndrome (CTS), 34% were positive for amyloid and 100% were positive for TTR.					1.0					
25940564	7276	D002357	Transthyretin | TTR	articular cartilage | cartilage | cartilage degradation | cartilage damage | cartilage and joint homeostasis	1	1	1.0	10	7.0	1.0	1.0				Transthyretin deposition in articular cartilage	1.0				4.0					1.0
25940564	7276	D003643	Transthyretin | TTR	death	1	1	1.0	3			1.0	Di			In cultured chondrocytes, only an amyloidogenic TTR variant induced cell death, the expression of proinflammatory cytokines, and extracellular matrix degrading enzymes.	1.0									
25940564	7276	D006984	Transthyretin | TTR	hypertrophy	0	0	1.0	3			0.0														
25940564	7276	D007249	Transthyretin | TTR	inflammation	0	1	1.0	4			1.0		mC		To determine whether TTRs stimulate the production of mediators of inflammation and cartilage degradation, we treated chondrocytes with the recombinant TTR variants and analyzed changes in gene expression using quantitative PCR. Expression of IL6, iNOS and ADAMTS4, but not that of MMP13, were significantly induced by V122I TTR 				1.0						
25940564	7276	D009101	Transthyretin | TTR	senile systemic amyloidosis	1	1	1.0	4			1.0				Wild-type TTR is associated with the syndrome known as senile systemic amyloidosis 		1.0								
25940564	7276	D009202	Transthyretin | TTR	familial amyloid cardiomyopathy | cardiomyopathy	1	1	1.0	3			1.0				Biomechanical changes in the heart are a mechanisms involved in TTR-amyloid deposition in patients with TTR mutations and cardiomyopathy.		1.0			1.0					
25940564	7276	D010003	Transthyretin | TTR	osteoarthritis | osteoarthritic (OA) joints	1	1	1.0	6	2.0	1.0	1.0	Dr			aged normal and OA cartilage showed significantly higher rates of TTR deposition compared to young normal cartilage	1.0			3.0	4.0					1.0
25940564	7276	D014693	Transthyretin | TTR	fibrillation	0	1	1.0	3			1.0				 TTR antibody compared to aged normal cartilage, predominantly in areas with fibrillation.				1.0						
25940564	7276	D028227	Transthyretin | TTR	familial amyloidotic polyneuropathy	1	1	1.0	4			1.0				familial amyloidotic polyneuropathy (FAP), characterized by TTR deposition in peripheral nerve and heart. 		1.0								
25940564	7276	D064420	Transthyretin | TTR	cytotoxicity	1	1	1.0	5			1.0	Di			TTR-induced cytotoxicity was inhibited by resveratrol, a plant polyphenol that stabilizes the native tetrameric structure of TTR.	1.0									
25946018	3553	D002006	IL-1beta	Brucella abortus Induces the Premature Death | brucellosis | Brucella infected PMNs | Brucella-host cross-talk | Brucella-infected PMNs | Brucella infected | Brucella infection | chronic brucellosis display absolute neutropenia	0	0	1.0	3		1.0	1.0				This result is consistent with the low cytokine production by Brucella infected or Br-LPS treated macrophages, or by Brucella infected mice at early time points of infection.				1.0						1.0
25946018	3576	D002006	IL-8	Brucella abortus Induces the Premature Death | brucellosis | Brucella infected PMNs | Brucella-host cross-talk | Brucella-infected PMNs | Brucella infected | Brucella infection | chronic brucellosis display absolute neutropenia	0	1		0		0.0	0.0														
25946018	7099	D001424	LPS | TLR4	bacterial infections	1	1	1.0	3			1.0				The consensus in Gram negative bacterial infections is that the endotoxic LPS molecule and other PAMPs					1.0					
25946018	7099	D002006	LPS | TLR4	Brucella abortus Induces the Premature Death | brucellosis | Brucella infected PMNs | Brucella-host cross-talk | Brucella-infected PMNs | Brucella infected | Brucella infection | chronic brucellosis display absolute neutropenia	1	1	1.0	9	3.0	1.0	1.0				This approach revealed that significant amounts of Br-LPS molecules (green fluorescence) were released intracellularly by live (red fluorescent) Brucella in the proximity of bacteria-containing PMN phagosomes (Fig 4).				1.0	1.0					1.0
25946018	7099	D005198	LPS | TLR4	FBS	1	1	1.0	3			0.0	Dki													
25946018	7099	D009336	LPS | TLR4	necrosis	0	0	1.0	3			0.0														
25946018	7099	D010198	LPS | TLR4	pancytopenia	0	0	1.0	3			0.0														
25946018	7099	D011273	LPS | TLR4	prolonging	0	0	1.0	3			0.0	Dki												ill D	
25946018	7099	D011595	LPS | TLR4	agitation	0	0	1.0	3			0.0	Dki													
25946018	7124	D002006	TNF-alpha	Brucella abortus Induces the Premature Death | brucellosis | Brucella infected PMNs | Brucella-host cross-talk | Brucella-infected PMNs | Brucella infected | Brucella infection | chronic brucellosis display absolute neutropenia	0	0		0	1.0	1.0	1.0				Regardless whether blood or purified PMNs were tested, the levels of TNF-alpha, IL-1beta and IL-6 were comparatively low after Brucella infection or Br-LPS treatment.				1.0						1.0
25960081	529	D000275	E2	depression	0	0	1.0	6			0.0	Gk			behavioral effects of E2 will also be essential to understanding why women are at greater risk than men of developing psychiatric and neurodegenerative diseases such as mood and anxiety disorders, and Alzheimer's disease.						1.0			NER ID	
25960081	529	D000544	E2	Alzheimer's disease	0	0	1.0	4			1.0	Gk			behavioral effects of E2 will also be essential to understanding why women are at greater risk than men of developing psychiatric and neurodegenerative diseases such as mood and anxiety disorders, and Alzheimer's disease.						1.0				
25960081	529	D001008	E2	anxiety disorders	0	0	1.0	4			1.0	Gk			behavioral effects of E2 will also be essential to understanding why women are at greater risk than men of developing psychiatric and neurodegenerative diseases such as mood and anxiety disorders, and Alzheimer's disease.						1.0				
25960081	529	D001523	E2	psychiatric	0	0	1.0	4			1.0	Gk			behavioral effects of E2 will also be essential to understanding why women are at greater risk than men of developing psychiatric and neurodegenerative diseases such as mood and anxiety disorders, and Alzheimer's disease.						1.0				
25960081	529	D001943	E2	breast cancer	0	0	1.0	4			0.0	Gk													
25960081	529	D003072	E2	cognitive dysfunction	0	0	1.0	7			0.0	Gk													
25960081	529	D006331	E2	heart disease	0	0	1.0	4			0.0	Gk													
25960081	529	D007511	E2	ischemia	1	0	1.0	5			1.0	Gk	LC		 The loss of this neuroprotection after ovariectomy or during aging may render hippocampal neurons less responsive to hippocampally-synthesized E2 or more vulnerable to dysfunction due to aging, cellular damage, or ischemia.		1.0								
25960081	529	D007635	E2	increase dendritic	1	1	1.0	7			0.0	GkDki													
25960081	529	D008569	E2	recall | impaired spatial memory	0	0	1.0	5		0.0	0.0	Gk													
25960081	529	D010051	E2	ovaries	1	1	1.0	9			0.0	GkDki													
25960081	529	D019636	E2	neurodegenerative diseases	0	0	1.0	4			1.0	Gk			behavioral effects of E2 will also be essential to understanding why women are at greater risk than men of developing psychiatric and neurodegenerative diseases such as mood and anxiety disorders, and Alzheimer's disease.						1.0				
25960081	529	D019964	E2	mood	0	0	1.0	4			1.0	GkDki			behavioral effects of E2 will also be essential to understanding why women are at greater risk than men of developing psychiatric and neurodegenerative diseases such as mood and anxiety disorders, and Alzheimer's disease.						1.0			Mood Disorders	
25960081	529	D020521	E2	stroke	0	0	1.0	4			0.0	Gk													
25965909	27344	D013313	pen	PTSD	0	0		0	3.0	0.0	0.0	Gki												pen-and-paper	
25965909	9033	D013313	PCL	PTSD	1	1	1.0	4	2.0	0.0	0.0	Gk												1 G 2 ID PTSD Checklist Civilian Version	
25965909	930	D013313	B4 and B5	PTSD	0	0		0	1.0	0.0	0.0														
25999344	7013	D009373	TRF1 | TRF	Drosophila embryonic	0	0	1.0	8	1.0	0.0	0.0	Dki													
25999344	7014	D009373	TRF2 | TRF2-Myb	Drosophila embryonic	1	1	1.0	3			0.0	Dki													
26000277	7276	D002349	CTS	Carpal tunnel syndrome	1	1	1.0	9	5.0	0.0	0.0	Gm												Critical NER error, mesh up G/D	
26061049	1030	D056735	p15	ALPS | amphipathic ALPS motifs	1	1	1.0	10	10.0	1.0	1.0				Most notably, the p15 FLiPS can be functionally replaced by heterologous amphipathic lipid packing sensors (ALPS) but not by other membrane-interactive amphipathic helices. F	2.0				2.0					1.0
