pmid	geneId	diseaseId	g_name	d_name	is_befree	is_dtminer	is_ft1	hit_ft1	hit_abs	1st_label	2nd_label	is_ner_error	is_complex	have_s	target_sentences	in abs	in_intro	in_method	in_result	in_diss	in_conclusion	Have -	S no strong	comment	is_target_knowledge
27642274	2516	D064420	ELP	cytotoxicity	0	0		0	1.0	0.0	0.0														
27751272	2147	D009203	prothrombin	acute myocardial infarction | anterior myocardial infarction | myocardial infarction	0	0	1.0	10	10.0	0.5	0.5				Inherited procoagulable syndromes were ruled out with laboratory tests. Factor V Leiden gene mutation and prothrombin gene mutation were negative.		1.0					1.0			1.0
27751272	2153	D009203	Factor V Leiden	acute myocardial infarction | anterior myocardial infarction | myocardial infarction	0	0	1.0	10	9.0	0.5	0.5				Inherited procoagulable syndromes were ruled out with laboratory tests. Factor V Leiden gene mutation and prothrombin gene mutation were negative.		1.0					1.0			1.0
27751272	2244	D009203	fibrinogen	acute myocardial infarction | anterior myocardial infarction | myocardial infarction	0	0	1.0	10	9.0	0.5	0.5						1.0					1.0			1.0
27785854	3267210	D006130	PrgB | prgB | Aggregation Substance	growth defects | growth impairment	0	1	1.0	3			1.0				Cells engineered to overproduce PrgB, even independently of other pCF10-encoded proteins, have severely compromised cell envelopes and strong growth defects.	1.0									
27785854	3267210	D064420	PrgB | prgB | Aggregation Substance	toxicity	1	1	1.0	9	1.0	0.0	1.0	Di			Together, our findings support a model in which PrgU proteins represent a novel class of RNA-binding regulators that act to mitigate toxicity	1.0	1.0		1.0	1.0				ill D	
27790004	1401	D010003	C-reactive protein	osteoarthritis	0	0		0	1.0	0.0	0.0														
27790004	4512	D014456	COX-1	ulcers | ulcer | upper gastrointestinal ulcer complications | ulcer complications | ulcer-free	1	1	1.0	7	2.0	1.0	1.0				Economic modeling suggests that a COX-1 NSAID plus an H2RA or a COX-1 NSAID plus a proton pump inhibitor are the most cost-effective strategies for avoiding endoscopic ulcers in patients requiring long-term NSAID therapy.		1.0								1.0
27790004	4513	D010003	COX-2 | cyclo-oxygenase (COX)-2 | Cyclo-oxygenase (COX)-2	osteoarthritis	1	1		0	1.0	1.0	1.0				NSAIDs and COX-2 selective inhibitors are useful pharmacological treatment options for symptom relief in patients with osteoarthritis and rheumatoid arthritis.						1.0				1.0
27790004	4513	D014456	COX-2 | cyclo-oxygenase (COX)-2 | Cyclo-oxygenase (COX)-2	ulcers | ulcer | upper gastrointestinal ulcer complications | ulcer complications | ulcer-free	1	1	1.0	4	1.0	1.0	1.0				the use of a COX-2 inhibitor produces a lower risk of ulcer development than the use of a nonselective NSAID.		1.0							intro + conclu	1.0
27790004	495	D010003	proton pump | Proton pump	osteoarthritis	1	1	1.0	7	1.0	0.0	1.0	Gi			for people with osteoarthritis and lower risk of cardiovascular adverse events, a COX-2 selective inhibitor plus a proton pump inhibitor might be the most cost-effective treatment option.		1.0								
27790004	495	D014456	proton pump | Proton pump	ulcers | ulcer | upper gastrointestinal ulcer complications | ulcer complications | ulcer-free	1	1	1.0	9	1.0	0.0	1.0	Gi			Several trials have demonstrated superior healing rates in NSAID-induced ulcers with proton pump inhibitors compared with ranitidine.		1.0								
27790004	50848	D014456	JAMA	ulcers | ulcer | upper gastrointestinal ulcer complications | ulcer complications | ulcer-free	1	0	1.0	5	1.0	0.0	0.0	Gki													
27803720	2195	D000072861	fat	social anxiety | social interaction anxiety	0	0		0	1.0	0.0	0.0	Gki													
27808126	7295	D011125	Trx	GS	1	1		0	2.0	0.0	0.0	Dki													
27808126	7295	D015658	Trx	immunodeficiency virus | HIV viruses | HIV-1/HIV-2 infection	0	0		0	3.0	0.0	0.0														
27843468	1636	D005776	angiotensinconverting enzyme | ACE	Gaucher Disease | Gaucher disease | GD | acute neuronopathic disease | GD type III | GD type I	0	1	1.0	9	5.0	1.0	1.0				several serum analytes have been described for monitoring GD including pulmonary and activationregulated chemokine (PARC/CCL18), angiotensinconverting enzyme (ACE), macrophage inflammatory proteins (MIP)-1alpha, MIP-1beta, CD163 and etc..		1.0								0.0
27843468	2629	D005776	glucocerebrosidase | GBA	Gaucher Disease | Gaucher disease | GD | acute neuronopathic disease | GD type III | GD type I	1	1	1.0	10	7.0	1.0	1.0				Gaucher Disease (GD) is an inherited metabolic disorder of lysosomal storage disease (LSDs) occurred by deficient activity of the glucocerebrosidase (GBA).		1.0								0.0
27843468	4437	D005776	Dup	Gaucher Disease | Gaucher disease | GD | acute neuronopathic disease | GD type III | GD type I	1	1	1.0	10	6.0	1.0	1.0				In our study, after adjusting the CT Dup 24 genotype, GD type III patients had an insignificantly higher mean of CT activity than GD type I patients.					1.0					1.0
27843468	6348	D005776	macrophage inflammatory proteins (MIP)-1alpha	Gaucher Disease | Gaucher disease | GD | acute neuronopathic disease | GD type III | GD type I	0	1	1.0	8	5.0	1.0	1.0				Gaucher Disease (GD) is an inherited metabolic disorder of lysosomal storage disease (LSDs) occurred by deficient activity of the glucocerebrosidase (GBA).		1.0								0.0
27843468	6351	D005776	MIP-1beta	Gaucher Disease | Gaucher disease | GD | acute neuronopathic disease | GD type III | GD type I	0	1	1.0	6	4.0	1.0	1.0				Gaucher Disease (GD) is an inherited metabolic disorder of lysosomal storage disease (LSDs) occurred by deficient activity of the glucocerebrosidase (GBA).		1.0								0.0
27843468	6362	D005776	PARC | CCL18	Gaucher Disease | Gaucher disease | GD | acute neuronopathic disease | GD type III | GD type I	1	1	1.0	9	5.0	1.0	1.0				Gaucher Disease (GD) is an inherited metabolic disorder of lysosomal storage disease (LSDs) occurred by deficient activity of the glucocerebrosidase (GBA).		1.0								0.0
27843468	9332	D005776	CD163	Gaucher Disease | Gaucher disease | GD | acute neuronopathic disease | GD type III | GD type I	0	1	1.0	6	5.0	1.0	1.0				Gaucher Disease (GD) is an inherited metabolic disorder of lysosomal storage disease (LSDs) occurred by deficient activity of the glucocerebrosidase (GBA).		1.0								0.0
27880818	6566	C535298	MCT1 | SLC16A1	leakiness	1	1	1.0	3			0.0	Dki													
27880818	6566	D000860	MCT1 | SLC16A1	hypoxia | hypoxia increases	0	0	1.0	8			0.0	Dki													
27880818	6566	D004342	MCT1 | SLC16A1	hypersensitivity	0	1	1.0	7			1.0				A MYC binding site was located within a relatively open region in the MCT1 promoter, while a NF-kappaB binding site was located in an area of reduced hypersensitivity.				1.0						
27880818	6566	D005198	MCT1 | SLC16A1	FBS	0	0	1.0	5	1.0	0.0	0.0	Dki													
27880818	6566	D007662	MCT1 | SLC16A1	ketoacidosis	1	1	1.0	3			1.0				Recent genetic analysis of patients with severe ketoacidosis identified several inactivating mutations in MCT1					1.0					
27880818	6566	D009447	MCT1 | SLC16A1	pediatric neuroblastoma	0	0	1.0	3			0.0														
27880818	6566	D011535	MCT1 | SLC16A1	PBS	0	0	1.0	3			0.0	Dki													
27880818	6566	D012878	MCT1 | SLC16A1	skin cancer | aggressive skin cancer	0	0	1.0	4			0.0														
27880818	6566	D015266	MCT1 | SLC16A1	Merkel cell carcinoma	0	0	1.0	4			0.0														
27880818	6566	D055752	MCT1 | SLC16A1	small cell lung cancer	0	0	1.0	3			0.0														
27956798	284	D019698	Ang1 | Ang-1	cirrhosis in chronic hepatitis C | chronic hepatitis C | CHC | non-cirrhotic CHC	1	1	1.0	5	3.0	1.0	1.0				Peripheral blood concentrations of Ang1 and Ang2 in CHC patients were significantly related to fibrosis.	2.0				1.0					1.0
27956798	285	D004194	Ang2 | Ang-2 | angiopoietin-2	CLD diseases	0	0	1.0	10			1.0		Cm		Angiopoitein-1 (Ang1) and angiopoitein-2 (Ang2) have similar affinity toward Tie2 but their effects are quite different and context dependent. Interestingly, the balance between both angiopoietins is altered in several CLD diseases, with its highest manifestation in HCC.		1.0								
27956798	285	D005355	Ang2 | Ang-2 | angiopoietin-2	cirrhosis | fibrosis | fibrosis determination | fibrosis-cirrhosis	1	1	1.0	10	10.0	1.0	1.0				Peripheral blood concentrations of Ang1 and Ang2 in CHC patients were significantly related to fibrosis.	2.0				1.0					1.0
27956798	285	D008103	Ang2 | Ang-2 | angiopoietin-2	liver cirrhosis | liver fibrosis | cirrhosis and hepatocellular carcinoma	1	1	1.0	10	10.0	1.0	1.0				Ang2/Ang1 ratio improved the performance of many other previously described biomarkers or scores of liver cirrhosis in CHC.	1.0			1.0						1.0
27956798	285	D008107	Ang2 | Ang-2 | angiopoietin-2	liver disease | liver diseases	1	1	1.0	10			1.0				Ang2 was significantly increased as CHC progressed to the end stage of liver disease	1.0			1.0						
27956798	285	D008108	Ang2 | Ang-2 | angiopoietin-2	alcoholic liver disease	1	1	1.0	10			1.0				Pauta et al also reported higher levels of Ang2 in the systemic and suprahepatic circulation of cirrhotic patients with alcoholic liver disease and established the inverse correlation of Ang1/Ang2 with prognostic models of the disease. 					1.0					
27956798	285	D009360	Ang2 | Ang-2 | angiopoietin-2	suprahepatic circulation of cirrhotic	1	1	1.0	10			1.0				Pauta et al also reported higher levels of Ang2 in the systemic and suprahepatic circulation of cirrhotic patients with alcoholic liver disease and established the inverse correlation of Ang1/Ang2 with prognostic models of the disease. 					1.0					
27956798	285	D009369	Ang2 | Ang-2 | angiopoietin-2	tumors	1	1	1.0	10			1.0				The unbalance between Ang1 and Ang2 is present in many tumors such as HCC as well as in diverse chronic liver diseases underlining their potential pathogenic role and their impact as targets for therapeutic intervention.					1.0					
27956798	285	D019698	Ang2 | Ang-2 | angiopoietin-2	cirrhosis in chronic hepatitis C | chronic hepatitis C | CHC | non-cirrhotic CHC	1	1	1.0	10	10.0	1.0	1.0				While Ang1 was decreased in cirrhotic subjects compared to non-cirrhotic (P < 0.0001), Ang2 was significantly increased as CHC progressed to the end stage of liver disease	3.0				1.0					1.0
27956798	285	D056486	Ang2 | Ang-2 | angiopoietin-2	liver injury	0	0	1.0	10			1.0				Previous evidences suggested the possible pathogenic role of the Angiopoietins/Tie-2 system on cirrhosis development, thus highlighting its potential to detect the degree of liver injury. 					1.0					
27990348	1956	D002289	EGFR | epidermal Growth Factor Receptor	non-small cell lung cancer	1	1	1.0	9			1.0				Approximately 10-35% of patients with non-small cell lung cancer have mutations in the epidermal Growth Factor Receptor (EGFR) gene. 				1.0					good easy case of GDA	
28150320	31	D001008	dACC	anxiety disorders | anxiety psychopathology | anxiety | anxiety disorder | anxiety disorder brain-behavior	1	1	1.0	7	1.0	0.0	0.0	Gki												NER dorsal anterior cingulate cortex	
28150320	31	D003865	dACC	SAD | MDD	0	0	1.0	3			0.0	Gki													
28150320	31	D012021	dACC	startle | startle eyeblink potentiation | startle potentiation | heightened startle | startle-brain | brain startle | startle reflex	1	1	1.0	10	10.0	0.0	0.0	Gki												NER dorsal anterior cingulate cortex	
28169280	1962	D012080	PBE	MBD	1	1		0	5.0	0.0	0.0	Gki												NER Perdew, Burke, and Ernzerhof	
28195163	100523914	D020964	ZBED6	blastocyst | blastocysts	0	0		0	1.0	0.0	0.0	Dki													
28195163	494014	D020964	PRNP	blastocyst | blastocysts	1	1		0	1.0	1.0	0.0	Dki			Screening of injected embryos at the blastocyst stage demonstrated successful bi-allelic targeting of the PRNP locus as evidenced by large deletions				1.0						1.0
28277979	221656	C537985	LSD2 | KDM1B	PDB ID	1	1	1.0	4	2.0	0.0	0.0	Dki												NER Protein Data Bank	
28277979	23028	C535742	LSD1 | KDM1A | KDM1	PDB IDs	1	1	1.0	6		0.0	0.0	Dki												NER Protein Data Bank	
28277979	23028	C537985	LSD1 | KDM1A | KDM1	PDB ID	1	1	1.0	10	3.0	0.0	0.0	Dki												NER Protein Data Bank	
28277979	23028	C563168	LSD1 | KDM1A | KDM1	Ewing sarcoma tumor	0	0	1.0	4			1.0		mC		Noncovalent LSD1 inhibitors with submicromolar potency include a compound designated SP2509/HCl2509, which contains a benzohydrazide scaffold, inhibits LSD1 at an IC50 of 13 nM and has specificity for LSD1 over MAOs. This compound has been shown to impede the growth of Ewing sarcoma tumor cells and AML cells. 		1.0								
28277979	23028	D001102	LSD1 | KDM1A | KDM1	viral infection	0	0	1.0	4			0.0														
28277979	23028	D005909	LSD1 | KDM1A | KDM1	glioblastoma	1	1	1.0	4			1.0				In particular, the development of specific inhibitors for LSD1 is highly desirable because this enzyme has emerged as a key epigenetic modifier in the self-renewal of several cancer stem cells, such as leukemic stem cells in acute myeloid leukemia (AML) and glioblastoma stem-like tumor-propagating cells.		1.0								
28277979	23028	D007938	LSD1 | KDM1A | KDM1	leukemic	1	1	1.0	3			1.0				In particular, the development of specific inhibitors for LSD1 is highly desirable because this enzyme has emerged as a key epigenetic modifier in the self-renewal of several cancer stem cells, such as leukemic stem cells in acute myeloid leukemia (AML) and glioblastoma stem-like tumor-propagating cells.		1.0								
28277979	23028	D007947	LSD1 | KDM1A | KDM1	acute megakaryoblastic leukemia	1	1	1.0	4			1.0				Recently, Takeda Pharmaceuticals reported another N-alkylated 2-PCPA derivative as an LSD1 inhibitor. T-3775440 (8, Fig. 2) inhibits LSD1 irreversibly in vitro with an IC50 of 2.1 or 20 nM in the presence or absence of CoREST, respectively (Table 2), and exhibits rapid antiproliferative and pro-apoptotic activities against acute erythroid leukemia (AEL) and acute megakaryoblastic leukemia (AMKL) cells.		1.0								
28277979	23028	D008228	LSD1 | KDM1A | KDM1	non-Hodgkin's lymphoma	0	0	1.0	4			0.0		n												
28277979	23028	D009190	LSD1 | KDM1A | KDM1	myelodysplastic syndrome | MDS	0	0	1.0	4			0.0		n												
28277979	23028	D009369	LSD1 | KDM1A | KDM1	tumor | cancer | loss of cancer stemness | cancers	1	1	1.0	3			1.0				In particular, the development of specific inhibitors for LSD1 is highly desirable because this enzyme has emerged as a key epigenetic modifier in the self-renewal of several cancer stem cells, such as leukemic stem cells in acute myeloid leukemia (AML) and glioblastoma stem-like tumor-propagating cells. 		1.0								
28277979	23028	D010051	LSD1 | KDM1A | KDM1	ovarian cancer	0	1	1.0	4		1.0	1.0				with an IC50 of 1.4 nM against LSD1 and antiproliferation effects against LSD1-overexpressing cancer cells, including A2780 ovarian cancer cells. GSK354/GSK690		1.0								1.0
28277979	23028	D015470	LSD1 | KDM1A | KDM1	AML | acute myeloid leukemia | MLL-AF9 AML | acute erythroid leukemia	1	1	1.0	10	3.0	1.0	1.0				some irreversible LSD1 inhibitors have entered clinical trials for the treatment of AML and other diseases		5.0							intro + concl	1.0
28277979	23028	D018288	LSD1 | KDM1A | KDM1	SCLC	1	1	1.0	5			0.0		n												
28277979	23028	D019636	LSD1 | KDM1A | KDM1	neurodegenerative diseases	1	1	1.0	4			1.0				Some of the irreversible inhibitors show high selectivity and potency toward LSD1, and several of them are currently in clinical trials for the treatments of cancers and neurodegenerative diseases. 						1.0				
28277979	23028	D055752	LSD1 | KDM1A | KDM1	small cell lung cancer	1	1	1.0	5			1.0				 AML cell lines and small cell lung cancer (SCLC) cell lines are sensitive to LSD1 inhibition by these compounds. Several N-alkylated inhibitors		1.0								
28277979	23028	OMIM:300855	LSD1 | KDM1A | KDM1	N-terminal disordered	1	1	1.0	3			1.0				The tertiary structure of LSD1 except for approximately 170 residues of the N-terminal disordered region has been elucidated		1.0								
28360229	22796	D050197	low-density lipoprotein cholesterol | LDL-C	subclinical atherosclerosis | atherosclerosis | atherosclerotic	0	0		0	1.0	0.0	0.0														
28428661	2006	D000076385	elastin	Diverticular disease of the colon | diverticular disease	0	0		0	2.0	0.0	0.0														
28604785	100127147	D015430	SELL | SELL) | SELL, | (SELL)	weight gain	0	0		0	1.0	0.0	0.0														
28604785	397216	D015430	delta 1 (OPRD1 | OPRD1	weight gain	0	0		0	1.0	1.0	1.0	Gk			OPRD1 knockout mice fed with high energy diet were found to be resistant to weight gain and had lower fat mass.					1.0				Gene Id errors, multiple Id	1.0
28612977	671	D000275	BP-I	depression | depressed | depressive episode | depressive symptoms | depressive | Depression	0	0		0	3.0	0.0	0.0	Gki												bipolar disorder	
28689374	6582	D007674	OCT2 | Oct2 | Slc22a2 | Oct1/2(-/-)	nephrotoxicity | renal injury | injury to renal tubular | nephrotoxic | renal damage | renal tubular damage | renal toxicities	1	1	1.0	4	3.0	1.0	1.0				Cisplatin is among the most widely used anticancer drugs and known to cause a dose-limiting nephrotoxicity, which is partially dependent on the renal uptake carrier OCT2.	1.0	1.0			2.0					1.0
28689374	9356	D005198	OAT1 | SLC22A6 | Oat1 | Oat1(-/-) mice)11 | Slc22a6 | Oat1(-/-) mice | Oat1(-/-) | Oat1(-/-) mice)	necrotic tubular | proximal tubular damage | tubular injury	1	1	1.0	6			1.0				The lesions observed in kidneys of cisplatin-treated wildtype mice were characterized by dilated tubules filled with necrotic tubular epithelial cells, cellular debris, and proteinaceous casts, whereas the glomeruli, which do not express Oat1 or Oat3				1.0	1.0					
28689374	9356	D007674	OAT1 | SLC22A6 | Oat1 | Oat1(-/-) mice)11 | Slc22a6 | Oat1(-/-) mice | Oat1(-/-) | Oat1(-/-) mice)	nephrotoxicity | renal injury | injury to renal tubular | nephrotoxic | renal damage | renal tubular damage | renal toxicities	1	1	1.0	10	8.0	1.0	1.0				We have identified a new mechanism to import a nephrotoxic cisplatin metabolite into the kidney, namely, by the organic anion pathway transporters OAT1 and OAT3.	1.0	2.0			3.0					1.0
28689374	9356	D064420	OAT1 | SLC22A6 | Oat1 | Oat1(-/-) mice)11 | Slc22a6 | Oat1(-/-) mice | Oat1(-/-) | Oat1(-/-) mice)	Toxicity | toxicities | cytotoxicity | toxicity	1	1	1.0	5			1.0				Cisplatin is among the most widely used anticancer drugs and known to cause a dose-limiting nephrotoxicity, which is partially dependent on the renal uptake carrier OCT2. 	1.0			1.0	1.0				ill D	
28689374	9376	D007674	OAT3 | SLC22A8 | Oat3 | Slc22a8 | Oat3(-/-)	nephrotoxicity | renal injury | injury to renal tubular | nephrotoxic | renal damage | renal tubular damage | renal toxicities	1	1	1.0	7	6.0	1.0	1.0				We have identified a new mechanism to import a nephrotoxic cisplatin metabolite into the kidney, namely, by the organic anion pathway transporters OAT1 and OAT3.	1.0	2.0			3.0					1.0
28777375	598	C537985	Bcl-xL | Bcl-XL	PDB ID	1	1	1.0	4			0.0	Dki													
28777375	598	C538614	Bcl-xL | Bcl-XL	cell dysfunction	1	1	1.0	3			1.0		C		To test how inhibition of Bcl-xL leads to cell dysfunction and death, we assayed the Bcl-xL inhibitor ABT-737 at two different concentrations and studied cell death in response to glutamate toxicity.				1.0						
28777375	598	D000860	Bcl-xL | Bcl-XL	hypoxia-induced synaptic dysfunction	0	0	1.0	6			0.0														
28777375	598	D002545	Bcl-xL | Bcl-XL	neuronal ischemic damage	1	1	1.0	5			1.0				 A mouse expressing a cleavage resistant form of Bcl-xL is protected from neuronal ischemic damage.		1.0								
28777375	598	D002546	Bcl-xL | Bcl-XL	ischemic brain disease	0	0	1.0	4			0.0														
28777375	598	D003324	Bcl-xL | Bcl-XL	ischemic injury	0	1	1.0	5	1.0	1.0	1.0				we also found that ABT-737 protects rodent brain from ischemic injury in vivo by inhibiting formation of the pro-apoptotic, cleaved form of Bcl-xL, DeltaN-Bcl-xL.	1.0								ABS only	1.0
28777375	598	D003643	Bcl-xL | Bcl-XL	death | ischemic death | necrotic death | neurotoxic death	1	1	1.0	5			1.0				High ABT-737 markedly increased DeltaN-Bcl-xL formation, aggravated glutamate-induced death and resulted in the loss of mitochondrial membrane potential and decline in ATP production. Although the usual cause of death by ABT-737 is thought to be related to activation of Bax at the outer mitochondrial membrane due to sequestration of Bcl-xL	1.0			1.0	1.0					
28777375	598	D007511	Bcl-xL | Bcl-XL	ischemia | ischemia-induced cell death	1	1	1.0	6			1.0				the caspase-dependent N-terminal cleaved product of Bcl-xL, is produced in the brain during ischemia and activates large conductance mitochondrial channel activity similar to the activity of oligomerized Bax		1.0			1.0					
28777375	598	D008223	Bcl-xL | Bcl-XL	lymphoma	1	1	1.0	3			1.0	Dki			ABT-737 is a pharmacological inhibitor of the anti-apoptotic activity of B-cell lymphoma-extra large (Bcl-xL) protein; it promotes apoptosis of cancer cells by occupying the BH3-binding pocket.	1.0									
28777375	598	D009369	Bcl-xL | Bcl-XL	cancer	1	1	1.0	3			1.0				ABT-737 is a pharmacological inhibitor of the anti-apoptotic activity of B-cell lymphoma-extra large (Bcl-xL) protein; it promotes apoptosis of cancer cells by occupying the BH3-binding pocket.	1.0									
28777375	598	D009410	Bcl-xL | Bcl-XL	neuronal death | neurites to degeneration	1	1	1.0	10	6.0	1.0	1.0				indicating that inhibition of Bcl-xL alters cellular metabolism to predispose to neuronal death during excitotoxic stimulation.				1.0						1.0
28777375	598	D020258	Bcl-xL | Bcl-XL	neurotoxicity | neurotoxic | neurotoxic insult	1	1	1.0	6			1.0				a more selective Bcl-xL inhibitor WEHI-539 (5 muM) enhances glutamate-induced neurotoxicity while a low concentration of ABT-737 (10 nM) or WEHI-539 (10 nM) is neuroprotective.	1.0								ill D	
28777375	598	D058225	Bcl-xL | Bcl-XL	soma and neurites	1	1	1.0	6			0.0	Dki													
28777375	598	D064420	Bcl-xL | Bcl-XL	toxicity | cytotoxicity	1	1	1.0	10			1.0				it also inhibits the decline in mitochondrial potential produced by glutamate toxicity or by direct application of DeltaN-Bcl-xL to mitochondria.	1.0								ill D	
28811962	4919	C537730	ROR1 | Receptor tyrosine kinase-like orphan receptor 1	HPAF-II	0	1	1.0	8	1.0	0.0	0.0	Dki													
28811962	4919	C563168	ROR1 | Receptor tyrosine kinase-like orphan receptor 1	Ewing sarcoma	0	1	1.0	7	1.0	1.0	1.0				Receptor tyrosine kinase-like orphan receptor 1 (ROR1) is a surface antigen present at high levels on an array of hematological malignancies		1.0								1.0
28811962	4919	D001943	ROR1 | Receptor tyrosine kinase-like orphan receptor 1	MCF-7 breast cancer | breast cancer	1	1	1.0	9	1.0	0.0	1.0				 T cells and ROR1 BiTE were co-cultured with either ROR1 positive MDA-MB-231 or ROR1 negative MCF-7 breast cancer cell lines. 				1.0						
28811962	4919	D005198	ROR1 | Receptor tyrosine kinase-like orphan receptor 1	FBS	0	0	1.0	7			0.0	Dki													
28811962	4919	D005909	ROR1 | Receptor tyrosine kinase-like orphan receptor 1	glioblastoma	1	1	1.0	9	1.0	1.0	1.0				the potential of targeting ROR1 expressed by cancer-initiating cells such as those derived from ovarian cancer and glioblastoma may mitigate the risk of relapse and raise the potential of a cure.		1.0								1.0
28811962	4919	D008113	ROR1 | Receptor tyrosine kinase-like orphan receptor 1	hepatic cancer	1	1	1.0	9	1.0	0.0	1.0				we tested our ROR1 BiTE in vitro against a panel of ROR1 positive cell lines representing melanoma (T618A), glioblastoma (U-251, A 172), prostate (DU145, PC-3), and hepatic cancer (SK-Hep-1, HUH7) and confirmed significant cytotoxicity against all of these ROR1 positive cell lines				1.0						
28811962	4919	D008545	ROR1 | Receptor tyrosine kinase-like orphan receptor 1	melanoma	1	1	1.0	9			1.0				we tested our ROR1 BiTE in vitro against a panel of ROR1 positive cell lines representing melanoma (T618A), glioblastoma (U-251, A 172), prostate (DU145, PC-3), and hepatic cancer (SK-Hep-1, HUH7) and confirmed significant cytotoxicity against all of these ROR1 positive cell lines		1.0		1.0						
28811962	4919	D009362	ROR1 | Receptor tyrosine kinase-like orphan receptor 1	metastases	1	1	1.0	9	1.0	1.0	1.0				high ROR1 levels on tumor cells correlate with metastases and poor outcomes.		1.0								1.0
28811962	4919	D010051	ROR1 | Receptor tyrosine kinase-like orphan receptor 1	ovarian cancer | HEY ovarian cancer	1	1	1.0	8	1.0	1.0	1.0				the potential of targeting ROR1 expressed by cancer-initiating cells such as those derived from ovarian cancer and glioblastoma may mitigate the risk of relapse and raise the potential of a cure.					1.0					1.0
28811962	4919	D010190	ROR1 | Receptor tyrosine kinase-like orphan receptor 1	pancreatic cancer | pancreatic tumor | pancreatic tumors | pancreatic and ovarian cancer | aggressive tumors like pancreatic cancer	1	1	1.0	10	4.0	1.0	1.0				Focusing initially on pancreatic cancer, we demonstrated that our ROR1 BiTE results in T cell mediated and antigen-specific cytotoxicity against ROR1-expressing pancreatic cancer cell lines in vitro at exceedingly low concentrations	1.0	2.0		2.0						1.0
28811962	4919	D010195	ROR1 | Receptor tyrosine kinase-like orphan receptor 1	pancreatic	1	1	1.0	7	1.0	1.0	1.0				Receptor tyrosine kinase-like orphan receptor 1 (ROR1) is a surface antigen present at high levels on an array of hematological malignancies		1.0		1.0	1.0					1.0
28811962	4919	D012640	ROR1 | Receptor tyrosine kinase-like orphan receptor 1	fitness	0	0	1.0	8	1.0	0.0	0.0														
28811962	4919	D013274	ROR1 | Receptor tyrosine kinase-like orphan receptor 1	gastric cancer	1	1	1.0	10	1.0	1.0	1.0				Receptor tyrosine kinase-like orphan receptor 1 (ROR1) is a surface antigen present at high levels on an array of hematological malignancies		1.0								1.0
28811962	4919	D013352	ROR1 | Receptor tyrosine kinase-like orphan receptor 1	subcutaneous tumors	0	0	1.0	9	1.0	0.0	0.0														
28811962	4919	D014842	ROR1 | Receptor tyrosine kinase-like orphan receptor 1	von	0	0	1.0	7			0.0	Dki													
